{"budget_profiles_sha256":"6caa74c5ce26bb9b003807b038508757ac6cb5a9fe6505c24467fb48a3e277eb","corpus_sha256":"03be9aafd2e39605e7a31d82bedff9d5d24061d7b2dddb1986fa78fa26b975c6","efficiency":{},"efficiency_tail_violations":[],"excluded_runs":{},"lifts":{"absolute_compliance_lift_millionths":null,"incremental_compliance_lift_millionths":null,"local_gap_incremental_lift_millionths":null},"local_gap":{"family_lifts_millionths":{},"paired_deltas":[],"scenario_ids":["B001","B003","B005","B007","B009","B013","B014","B015","B016","B017","B019","B021","B031","B033","B035","B036","B041","B043","B045","B046","B051","B053","B059","B063","B065","B066","B067","B071"]},"matrix":{"complete":false,"expected_slots":1224,"extra_slots":[],"missing_slots":["B002:1:0:alternative-unconfigured:candidate_skill","B002:1:0:alternative-unconfigured:no_skill","B002:1:0:alternative-unconfigured:upstream_skill","B002:1:0:primary:candidate_skill","B002:1:0:primary:no_skill","B002:1:0:primary:upstream_skill","B002:1:1:alternative-unconfigured:candidate_skill","B002:1:1:alternative-unconfigured:no_skill","B002:1:1:alternative-unconfigured:upstream_skill","B002:1:1:primary:candidate_skill","B002:1:1:primary:no_skill","B002:1:1:primary:upstream_skill","B002:1:2:alternative-unconfigured:candidate_skill","B002:1:2:alternative-unconfigured:no_skill","B002:1:2:alternative-unconfigured:upstream_skill","B002:1:2:primary:candidate_skill","B002:1:2:primary:no_skill","B002:1:2:primary:upstream_skill","B002:1:3:alternative-unconfigured:candidate_skill","B002:1:3:alternative-unconfigured:no_skill","B002:1:3:alternative-unconfigured:upstream_skill","B002:1:3:primary:candidate_skill","B002:1:3:primary:no_skill","B002:1:3:primary:upstream_skill","B002:1:4:alternative-unconfigured:candidate_skill","B002:1:4:alternative-unconfigured:no_skill","B002:1:4:alternative-unconfigured:upstream_skill","B002:1:4:primary:candidate_skill","B002:1:4:primary:no_skill","B002:1:4:primary:upstream_skill","B002:2:0:alternative-unconfigured:candidate_skill","B002:2:0:alternative-unconfigured:no_skill","B002:2:0:alternative-unconfigured:upstream_skill","B002:2:0:primary:candidate_skill","B002:2:0:primary:no_skill","B002:2:0:primary:upstream_skill","B002:2:1:alternative-unconfigured:candidate_skill","B002:2:1:alternative-unconfigured:no_skill","B002:2:1:alternative-unconfigured:upstream_skill","B002:2:1:primary:candidate_skill","B002:2:1:primary:no_skill","B002:2:1:primary:upstream_skill","B002:2:2:alternative-unconfigured:candidate_skill","B002:2:2:alternative-unconfigured:no_skill","B002:2:2:alternative-unconfigured:upstream_skill","B002:2:2:primary:candidate_skill","B002:2:2:primary:no_skill","B002:2:2:primary:upstream_skill","B002:2:3:alternative-unconfigured:candidate_skill","B002:2:3:alternative-unconfigured:no_skill","B002:2:3:alternative-unconfigured:upstream_skill","B002:2:3:primary:candidate_skill","B002:2:3:primary:no_skill","B002:2:3:primary:upstream_skill","B002:2:4:alternative-unconfigured:candidate_skill","B002:2:4:alternative-unconfigured:no_skill","B002:2:4:alternative-unconfigured:upstream_skill","B002:2:4:primary:candidate_skill","B002:2:4:primary:no_skill","B002:2:4:primary:upstream_skill","B002:3:0:alternative-unconfigured:candidate_skill","B002:3:0:alternative-unconfigured:no_skill","B002:3:0:alternative-unconfigured:upstream_skill","B002:3:0:primary:candidate_skill","B002:3:0:primary:no_skill","B002:3:0:primary:upstream_skill","B002:3:1:alternative-unconfigured:candidate_skill","B002:3:1:alternative-unconfigured:no_skill","B002:3:1:alternative-unconfigured:upstream_skill","B002:3:1:primary:candidate_skill","B002:3:1:primary:no_skill","B002:3:1:primary:upstream_skill","B002:3:2:alternative-unconfigured:candidate_skill","B002:3:2:alternative-unconfigured:no_skill","B002:3:2:alternative-unconfigured:upstream_skill","B002:3:2:primary:candidate_skill","B002:3:2:primary:no_skill","B002:3:2:primary:upstream_skill","B002:3:3:alternative-unconfigured:candidate_skill","B002:3:3:alternative-unconfigured:no_skill","B002:3:3:alternative-unconfigured:upstream_skill","B002:3:3:primary:candidate_skill","B002:3:3:primary:no_skill","B002:3:3:primary:upstream_skill","B002:3:4:alternative-unconfigured:candidate_skill","B002:3:4:alternative-unconfigured:no_skill","B002:3:4:alternative-unconfigured:upstream_skill","B002:3:4:primary:candidate_skill","B002:3:4:primary:no_skill","B002:3:4:primary:upstream_skill","B003:1:0:alternative-unconfigured:candidate_skill","B003:1:0:alternative-unconfigured:no_skill","B003:1:0:alternative-unconfigured:upstream_skill","B003:1:0:primary:candidate_skill","B003:1:0:primary:no_skill","B003:1:0:primary:upstream_skill","B003:1:1:alternative-unconfigured:candidate_skill","B003:1:1:alternative-unconfigured:no_skill","B003:1:1:alternative-unconfigured:upstream_skill","B003:1:1:primary:candidate_skill","B003:1:1:primary:no_skill","B003:1:1:primary:upstream_skill","B003:1:2:alternative-unconfigured:candidate_skill","B003:1:2:alternative-unconfigured:no_skill","B003:1:2:alternative-unconfigured:upstream_skill","B003:1:2:primary:candidate_skill","B003:1:2:primary:no_skill","B003:1:2:primary:upstream_skill","B003:1:3:alternative-unconfigured:candidate_skill","B003:1:3:alternative-unconfigured:no_skill","B003:1:3:alternative-unconfigured:upstream_skill","B003:1:3:primary:candidate_skill","B003:1:3:primary:no_skill","B003:1:3:primary:upstream_skill","B003:1:4:alternative-unconfigured:candidate_skill","B003:1:4:alternative-unconfigured:no_skill","B003:1:4:alternative-unconfigured:upstream_skill","B003:1:4:primary:candidate_skill","B003:1:4:primary:no_skill","B003:1:4:primary:upstream_skill","B003:2:0:alternative-unconfigured:candidate_skill","B003:2:0:alternative-unconfigured:no_skill","B003:2:0:alternative-unconfigured:upstream_skill","B003:2:0:primary:candidate_skill","B003:2:0:primary:no_skill","B003:2:0:primary:upstream_skill","B003:2:1:alternative-unconfigured:candidate_skill","B003:2:1:alternative-unconfigured:no_skill","B003:2:1:alternative-unconfigured:upstream_skill","B003:2:1:primary:candidate_skill","B003:2:1:primary:no_skill","B003:2:1:primary:upstream_skill","B003:2:2:alternative-unconfigured:candidate_skill","B003:2:2:alternative-unconfigured:no_skill","B003:2:2:alternative-unconfigured:upstream_skill","B003:2:2:primary:candidate_skill","B003:2:2:primary:no_skill","B003:2:2:primary:upstream_skill","B003:2:3:alternative-unconfigured:candidate_skill","B003:2:3:alternative-unconfigured:no_skill","B003:2:3:alternative-unconfigured:upstream_skill","B003:2:3:primary:candidate_skill","B003:2:3:primary:no_skill","B003:2:3:primary:upstream_skill","B003:2:4:alternative-unconfigured:candidate_skill","B003:2:4:alternative-unconfigured:no_skill","B003:2:4:alternative-unconfigured:upstream_skill","B003:2:4:primary:candidate_skill","B003:2:4:primary:no_skill","B003:2:4:primary:upstream_skill","B003:3:0:alternative-unconfigured:candidate_skill","B003:3:0:alternative-unconfigured:no_skill","B003:3:0:alternative-unconfigured:upstream_skill","B003:3:0:primary:candidate_skill","B003:3:0:primary:no_skill","B003:3:0:primary:upstream_skill","B003:3:1:alternative-unconfigured:candidate_skill","B003:3:1:alternative-unconfigured:no_skill","B003:3:1:alternative-unconfigured:upstream_skill","B003:3:1:primary:candidate_skill","B003:3:1:primary:no_skill","B003:3:1:primary:upstream_skill","B003:3:2:alternative-unconfigured:candidate_skill","B003:3:2:alternative-unconfigured:no_skill","B003:3:2:alternative-unconfigured:upstream_skill","B003:3:2:primary:candidate_skill","B003:3:2:primary:no_skill","B003:3:2:primary:upstream_skill","B003:3:3:alternative-unconfigured:candidate_skill","B003:3:3:alternative-unconfigured:no_skill","B003:3:3:alternative-unconfigured:upstream_skill","B003:3:3:primary:candidate_skill","B003:3:3:primary:no_skill","B003:3:3:primary:upstream_skill","B003:3:4:alternative-unconfigured:candidate_skill","B003:3:4:alternative-unconfigured:no_skill","B003:3:4:alternative-unconfigured:upstream_skill","B003:3:4:primary:candidate_skill","B003:3:4:primary:no_skill","B003:3:4:primary:upstream_skill","B005:1:0:alternative-unconfigured:candidate_skill","B005:1:0:alternative-unconfigured:no_skill","B005:1:0:alternative-unconfigured:upstream_skill","B005:1:0:primary:candidate_skill","B005:1:0:primary:no_skill","B005:1:0:primary:upstream_skill","B005:1:1:alternative-unconfigured:candidate_skill","B005:1:1:alternative-unconfigured:no_skill","B005:1:1:alternative-unconfigured:upstream_skill","B005:1:1:primary:candidate_skill","B005:1:1:primary:no_skill","B005:1:1:primary:upstream_skill","B005:1:2:alternative-unconfigured:candidate_skill","B005:1:2:alternative-unconfigured:no_skill","B005:1:2:alternative-unconfigured:upstream_skill","B005:1:2:primary:candidate_skill","B005:1:2:primary:no_skill","B005:1:2:primary:upstream_skill","B005:1:3:alternative-unconfigured:candidate_skill","B005:1:3:alternative-unconfigured:no_skill","B005:1:3:alternative-unconfigured:upstream_skill","B005:1:3:primary:candidate_skill","B005:1:3:primary:no_skill","B005:1:3:primary:upstream_skill","B005:1:4:alternative-unconfigured:candidate_skill","B005:1:4:alternative-unconfigured:no_skill","B005:1:4:alternative-unconfigured:upstream_skill","B005:1:4:primary:candidate_skill","B005:1:4:primary:no_skill","B005:1:4:primary:upstream_skill","B005:2:0:alternative-unconfigured:candidate_skill","B005:2:0:alternative-unconfigured:no_skill","B005:2:0:alternative-unconfigured:upstream_skill","B005:2:0:primary:candidate_skill","B005:2:0:primary:no_skill","B005:2:0:primary:upstream_skill","B005:2:1:alternative-unconfigured:candidate_skill","B005:2:1:alternative-unconfigured:no_skill","B005:2:1:alternative-unconfigured:upstream_skill","B005:2:1:primary:candidate_skill","B005:2:1:primary:no_skill","B005:2:1:primary:upstream_skill","B005:2:2:alternative-unconfigured:candidate_skill","B005:2:2:alternative-unconfigured:no_skill","B005:2:2:alternative-unconfigured:upstream_skill","B005:2:2:primary:candidate_skill","B005:2